{"$schema":"https://json-schema.org/draft/2020-12/schema","additionalProperties":true,"properties":{"directories":{"items":{"type":"object"},"type":"array"},"emitted_tasks":{"items":{"type":"string"},"type":"array"},"errors":{"items":{"type":"string"},"type":"array"},"files":{"items":{"type":"object"},"type":"array"},"git_head":{"type":["string","null"]},"repo_id":{"type":["string","null"]},"repo_root":{"type":["string","null"]},"scan_id":{"type":"string"},"scanned_at":{"type":"string"},"scanner_version":{"type":["string","null"]},"schema_version":{"minimum":1,"type":"integer"},"summary":{"additionalProperties":true,"properties":{"blocked":{"minimum":0,"type":"integer"},"dirs_scanned":{"minimum":0,"type":"integer"},"files_scanned":{"minimum":0,"type":"integer"},"missing":{"minimum":0,"type":"integer"},"needs_review":{"minimum":0,"type":"integer"},"stale":{"minimum":0,"type":"integer"},"tasks_emitted":{"minimum":0,"type":"integer"}},"required":["files_scanned","dirs_scanned","tasks_emitted"],"type":"object"}},"required":["schema_version","scan_id","scanned_at","summary"],"title":"scan","type":"object"}