{
  "directories": [
    {
      "ctx_path": "src/pkg/__pkg__.dir.json",
      "freshness_state": "fresh",
      "path": "src/pkg",
      "staleness_reasons": [],
      "subtree_hash_sha256": "cccccccccccccccccccccccccccccccccccccccccccccccccccccccccccccccc"
    }
  ],
  "emitted_tasks": [
    "task_000042"
  ],
  "errors": [],
  "files": [
    {
      "code_hash_sha256": "aaaaaaaaaaaaaaaaaaaaaaaaaaaaaaaaaaaaaaaaaaaaaaaaaaaaaaaaaaaaaaaa",
      "ctx_path": "src/pkg/__foo__.json",
      "freshness_state": "fresh",
      "path": "src/pkg/foo.py",
      "staleness_reasons": []
    }
  ],
  "git_head": "abcd1234",
  "repo_id": "repo:melder_private",
  "repo_root": "<local-workspace>",
  "scan_id": "scan_000001",
  "scanned_at": "2025-12-28T00:00:00Z",
  "scanner_version": "scanner@v1",
  "schema_version": 1,
  "summary": {
    "blocked": 0,
    "dirs_scanned": 1,
    "files_scanned": 1,
    "missing": 0,
    "needs_review": 0,
    "stale": 0,
    "tasks_emitted": 1
  }
}